Technical name,Name,Original performer,monthEstablished,yearEstablished,linkToVideo,Start position,End position,Difficulty,description,descriptionEs,tips,tipsEs,recommendedPrerequisites,dateAdded,isImportant,isVariationOf
FS 360 Barrel Roll,Overflow,Tim Odermatt,,2021,https://www.instagram.com/p/CSHcZfUFG9H/,STAND,STAND,-1,From your regular stance do a frontside 270 and roll around the line like you would for a Flowflip. Try to land back in your normal stance and not in Exposure.,Desde tu postura normal haz un 270 frontal y rueda alrededor de la línea como lo harías para un Flowflip. Intenta aterrizar de nuevo en tu postura normal y no en Exposure.,,,10171,1 Jan 2022,FALSE,10122
Barrel late Orbital 180,,Justin Wagers,,2021,https://www.instagram.com/p/CXJSAepFj4L/,STAND,CHEST,-1,Start with a Barrel Roll and then add an Orbital 180 in the same bounce.,Empieza con un Barrel Roll y luego añade un Orbital en el mismo rebote.,You gotta be quick for this one.,Tienes que ser rápido para esto.,10122;10206,1 Jan 2022,FALSE,10122
Half Nasty 180 Front Sofa Roll to Feet,Rubik's Cube,Ian Eisenberg,,2021,https://www.instagram.com/p/CPWrEFhKBUm/,SOFA,EXPOSURE,7,It's a Half Nasty 180 with a Front Sofa Roll landing in Exposure.,Es un Half Nasty 180 con un aterrizaje en exposición.,,,10214,1 Jan 2022,TRUE,
Makako to Feet,,Sakalomo,,2021,https://youtu.be/rWqH_51ztQA?t=5633,NEVERMIND,EXPOSURE,-1,Makako landing in Exposure.,Makako aterrizando en Exposición.,,,10052,1 Jan 2022,TRUE,
Despedido to Feet,,Sakalomo,,2021,https://youtu.be/HecUpHXRpDw?t=162,KOREAN,EXPOSURE,-1,Despedido landing in Exposure,Despedido aterrizando en Exposición,,,10170,1 Jan 2022,TRUE,
180 Super Sonic Mount,,Ian Eisenberg,,2021,https://youtu.be/HecUpHXRpDw?t=249,ROCKET,EXPOSURE,8,It's a Super Sonic late 180 or Rocket Rewind to Feet.,Es como un Rocket Rewind a Feet.,,,10149;10140,1 Jan 2022,FALSE,10063
360 Almighty Flip,,Ian Eisenberg,,2021,https://youtu.be/HecUpHXRpDw?t=367,STAND,STAND,8,360 Almighty Flip.,El verdadero Frente 360 Todopoderoso con la postura inicial y final siendo la misma.,,,10153,1 Jan 2022,TRUE,
Reverse Super Sonic Mount,,Samuel Volery,,2021,https://www.youtube.com/watch?v=EntnbHe_biY,ROCKET,EXPOSURE,-1,From Rocket get a lot of momentum with your feet and do one roll backwards around the line and land in Exposure.,Desde la suspensión coge mucho impulso con los pies y haz un giro hacia atrás alrededor de la línea y aterriza en la exposición.,,,10101;10121,1 Jan 2022,FALSE,10149
Shapeshifter to Feet,Ninja Shifta,Enzo Fuchs,,2021,https://www.instagram.com/p/CXOfVZGgZ7b/,EXPOSURE,EXPOSURE,8,Shapeshifter landing to feet.,Shapeshifter aterrizando a los pies.,,,10112,1 Jan 2022,TRUE,
Kung Pao to Feet,Shrimpzilla,Ian Eisenberg,,2021,https://www.instagram.com/p/CXXU9U7KvZ7/,ROCKET,EXPOSURE,-1,Shrimpflip to Reverse Rocket Mount.,Volteo de camarones a montura de cohete invertida.,,,10174,1 Jan 2022,TRUE,
Half-Nasty 360 Roll to Feet,Megaminx,Ian Eisenberg,,2022,https://www.instagram.com/p/C8ubJOaMydv/,SOFA,EXPOSURE,-1,"Start like you would for the Half-Nasty 180, but then keep spinning to do a 360 by regrabing your hands and finish Reverse Obi-Wan.",Piensa en ello como un cubo de Rubik 180.,,,10220,1 Jan 2022,TRUE,
180 Backflip,,Oscar Defoor,Feb,2022,https://www.instagram.com/p/CadBn6CjXqM/,STAND,EXPOSURE,-1,"Start in regular position, rotate 180° backside and do a backflip starting from switch position. Roll over the same shoulder as the normal backflip.","Comienza en posición normal, gira 180° hacia atrás y haz un backflip partiendo de la posición de cambio. Aterriza en el mismo hombro que la voltereta normal.",Get the 180° backflop as solid as possible first!,Primero haz el backflop de 180º lo más sólido posible. ,10148;10126,9 May 2022,FALSE,10148
Double Back Roll from Feet,Double Dibahia,Ian Eisenberg,,2022,https://www.instagram.com/p/CZh3qZata-5/,STAND,KOREAN,-1,Double Backroll from feet.,Doble retroceso desde los pies.,Protecting your arm from leashburns could be beneficial.,Proteger el brazo de las quemaduras por presión podría ser beneficioso.,10086,9 May 2022,FALSE,10068
Double Back Yoda Roll 180,Yodermatt,Tim Odermatt,,2022,https://www.instagram.com/p/Caf2ldqgtLc/,EXPOSURE,EXPOSURE,9,Back Yoda Roll to Back Yoda Roll 180 in one bounce.,Rollo de Yoda hacia atrás a Rollo de Yoda hacia atrás 180 en un rebote.,,,10150,9 May 2022,FALSE,10156
Triple Back Yoda Roll,,Davis Hermes,,2021,https://www.instagram.com/p/CUNMWEgAGP4/,EXPOSURE,EXPOSURE,9,Three Back Yoda Rolls in one bounce.,Tres Rollos de Yoda hacia atrás en un solo rebote.,,,10150,1 Jan 2022,TRUE,
Barrel Almighty Flip to Barrel Roll,Holy Grail,Davis Hermes,,2021,https://youtu.be/UdG4DNI0SNk?t=92,STAND,STAND,9,Start by doing a Barrel Almighty Flip and go for a second roll by grabbing the line and doing a Barrel Roll.,Empieza haciendo un Barrel Almighty Flip y haz una segunda tirada agarrando la línea y haciendo un Barrel Roll.,,,10154,1 Jan 2022,TRUE,
Darth Vader from Feet,Eisenvader,Ian Eisenberg,,2021,https://youtu.be/HecUpHXRpDw?t=436,EXPOSURE,EXPOSURE,9,Start in Expo and roll down until you are in Rocket. Then do a Darth Vader.,Comienza en la Expo y rueda hacia abajo hasta que estés bajo la línea. Entonces haz un Darth Vader.,,,10132;10095,1 Jan 2022,TRUE,
Double Back Almighty Flip,,Sebastian Egger,Sep,2021,https://youtu.be/HecUpHXRpDw?t=547,EXPOSURE,EXPOSURE,9,Double Back Almighty Flip.,Doble Vuelta Todopoderosa,Do the first one laid out and tuck for the second one to get good momentum.; Try to get the hook at your ankle. If the line is near your toes it's hard to pull it around for the second roll.,Haz la primera tirada y métete para la segunda para conseguir un buen impulso; Intenta que el gancho esté en tu tobillo. Si la línea está cerca de los dedos de los pies es difícil tirar de ella para la segunda tirada.,10150;10143,1 Jan 2022,FALSE,10167
Double Front Almighty Flip,,Sebastian Egger,Sep,2021,https://youtu.be/HecUpHXRpDw?t=780,EXPOSURE,EXPOSURE,9,Double Front Almighty Flip.,Doble vuelta frontal todopoderosa.,Stay open for the first one and tuck for the second one to get good momentum.,Quédate abierto en el primero y métete en el segundo para conseguir un buen impulso.,10156;10124,1 Jan 2022,TRUE,
Front Sofa Roll Rewind to Sick Nasty Double Roll,Double Boomerang,Ian Eisenberg,Feb,2022,https://youtu.be/rWqH_51ztQA?t=6940,SOFA,SOFA,-1,Start early with a Lightside Roll and use the resistance in the line to finish with a Double Sick Nasty Roll.,,,,,,FALSE,10243
Shrimpflip 360 to Feet,Shrimp Cocktail,Ian Eisenberg,Mar,2022,https://www.instagram.com/p/CbV9q1_p8DI/,ROCKET,EXPOSURE,8,"Start with a Shrimpflip, let go with one hand to initiate the 360 spin and land in Exposure.",,,,,,FALSE,10128
360 from Feet to Korean,Downward Spiral,Ian Eisenberg,Apr,2022,https://www.instagram.com/p/Cck9B16DcDi/,STAND,KOREAN,5,"Kick your back leg to the front, initiate a 360 with your upper body, and bring your front leg around to land in Korean.",,,,,,FALSE,10228
OH Back Handspring to Korean,Capoeira Flop,Ian Eisenberg,Apr,2022,https://www.instagram.com/p/Cck9B16DcDi/,STAND,KOREAN,-1,Do a OH Back Handspring to Korean.,,,,,,FALSE,10068
Front Sofa Roll Rewind to Sick Nasty Roll,Boomerang,Ian Eisenberg,Apr,2022,https://www.instagram.com/p/C87PZ0pMsjF/,SOFA,SOFA,6,Start early with a Lightside Roll and use the resistance in the line to finish with a Sick Nasty Roll.,,,,,,TRUE,
Sushi Backflop,,Ian Eisenberg,May,2022,https://www.instagram.com/p/CdsGGZrvNJ2/,STAND,KOREAN,7,Start with a early Sushi and go into the Backflop at the top of the bounce.,,,,,,FALSE,10068
Shrimp Mount,,Ian Eisenberg,May,2022,https://www.instagram.com/p/Cd7NRJeNEAa/,ROCKET,EXPOSURE,5,"From Rocket, stay below the line, pull just your legs up and kick in between the arms with extended legs. With the momentum from the leg kick, bring your body above the line, tuck your legs and land in Exposure.",,,,,,TRUE,
Double Drop Knee Almighty,,Ian Eisenberg,Jul,2022,https://www.instagram.com/p/CeVEh4DDYle/,DOUBLE DROP KNEE,EXPOSURE,-1,Almighty from DDK.,,,,,,FALSE,10136
Boomerang to Feet,Bangarang,Ian Eisenberg,Jul,2022,https://www.instagram.com/p/DAyphTxipiv/,SOFA,EXPOSURE,8,Boomerang to Feet.,,,,,,FALSE,10243
No Hands Back Panic Roll to Feet,Back Panic Attack,Ian Eisenberg,Jul,2022,https://www.instagram.com/p/Cfczh8IpvK4/,SOFA,EXPOSURE,7,"From Sofa, bring your back leg over the line (like a heel hook), initiate a roll backwards and immediately hook with your front foot, finish the roll and put your feet back on the line to land the trick.",,,,,,FALSE,10127
Front Sofa Roll Rewind to Mini-Cube,Boomerang 180,Ian Eisenberg,Jul,2022,https://www.instagram.com/p/CgUkGA0uVlA/,SOFA,SOFA,7,"This trick starts with an early Front Sofa Roll for which you grab both hands on your side (the Sick Nasty way). During the Front Sofa Roll, pass your legs over the line. Then use the resistance of the line to rewind your rolling direction and finish with the second half of a Mini-Cube.",,,,,,FALSE,10243
Reverse Rocket Mount 360 ,,Ian Eisenberg,Jul,2022,https://www.instagram.com/p/CgUkGA0uVlA/,ROCKET,EXPOSURE,-1,We haven't figured out yet what's going on here. Look at the video and help us by updating the description.,,,,,,FALSE,10074
Sushi Backflip,Sushi-Flip,Ian Eisenberg,Aug,2022,https://www.instagram.com/p/Cg8_eXWLmXw/,STAND,STAND,9,Start with an early Sushi and then do a Backflip at the top of the bounce.,,,,,,FALSE,10148
NH Backflip,,Ian Eisenberg,Aug,2022,https://www.instagram.com/p/Cg_eTDJLsZ6/,STAND,STAND,9,Do a Backflip without grabing the line.,,,,,,FALSE,10148
Batman,,Ian Eisenberg,Aug,2022,https://www.instagram.com/p/ChsA7RvrV7m/,ROCKET,ROCKET,5,"From Rocket, swing your legs to the side, hook the line with both feet, let go of your hands to ""hang"" on the line at the top of the bounce, finish the sidewards motion with your upper body and regrap with the hands. Let your feet go off the line to finish back in Rocket.",,,,,,FALSE,
Shark Bite,,Ian Eisenberg,Aug,2022,https://www.instagram.com/p/ChsA7RvrV7m/,ROCKET,ROCKET,4,"From Rocket, bite the line at the top of the bounce and let go of your hands at the same time. Regrab with your hands to finish the trick in Rocket at the bottom of the bounce.",,,,,,FALSE,
Antihero to Sofa Roll to Feet,Double Darth Vader,Ian Eisenberg,Aug,2022,https://www.instagram.com/p/ChsjejWLu8d/,ROCKET,EXPOSURE,9,Do an Antihero followed by a Sofa Roll to Feet in the same bounce.,,,,,,TRUE,
Darkside Almighty,All-Nasty,Ian Eisenberg,Aug,2022,https://www.instagram.com/p/Chxgwo6s6g_/,SOFA,EXPOSURE,8,"Start as you would for the Darkside Roll, but instead of putting the first foot on the line, hook it like for a Back Almighty, put the second foot on the line, let go of your hands and finish as you would for a Back Almighty.",,,,,,FALSE,10151
540 Rocket to Sofa,,Ian Eisenberg,Aug,2022,https://www.instagram.com/p/Ch11yrdsUEG/,ROCKET,SOFA,7,"From Rocket, pull yourself up half-way, then initiate the spin and land in Sofa.",,,,,,FALSE,10141
360 Back Almighty,,Ian Eisenberg,Sep,2022,https://www.instagram.com/p/Ch99aJdpyUo/,STAND,STAND,8,"Do a FS 270 spin, followed by a Back Almighty and spin another 90 degrees to finish looking back at the anchor. ",,,,,,FALSE,10162
Orbital to Double Drop Knee,,Ian Eisenberg,Aug,2022,https://www.instagram.com/p/Cjkb1LXrFci/,STAND,DOUBLE DROP KNEE,-1,Orbital to DDK.,,,,,,FALSE,10084
Shrimpflip 180 to Antihero,Shrimpy Hero,Justin Wagers,Feb,2022,https://www.instagram.com/p/CaPmmmsl1e3/,ROCKET,SOFA,7,"Start with a Shrimpflip, let go with one hand to initiate the 180 and finish with an Antihero, landing in Sofa.",,,,,,FALSE,10039;10060
Backbounce Panic Attack,Back Attack,Justin Wagers,Jun,2022,https://www.instagram.com/p/Ce3cq4OIs0l/,BACK,EXPOSURE,8,NH Panic Roll to feet starting from Backbounce.,,,,,,FALSE,10127
Holy Back No Soup,,Justin Wagers,Jul,2022,https://www.instagram.com/p/CgMeLKqogmm/,SOUP,EXPOSURE,8,NH Back Can of Soup to Back Yoda Roll in one bounce.,,,,,,FALSE,10165
360 Darth Vader,,Justin Wagers,Jul,2022,https://www.instagram.com/p/Cgb_ScXIF86/,ROCKET,EXPOSURE,9,Do a 360 and a Darth Vader at the same time.,,,,,,TRUE,
Back Holy Grail,,Justin Wagers,Aug,2022,https://www.instagram.com/p/Cgt9fIHIsrr/,EXPOSURE,EXPOSURE,9,Do a Back Almighty and a Back Yoda Roll in one bounce.,,,,,,FALSE,10165
Leash Orbital,Lando,Davis Hermes,Jul,2022,https://www.instagram.com/p/CgrrMmhgxhF/,STAND,KOREAN,7,"Do an Orbital, but grabing the leash instead of the line.",,,,,,FALSE,10084
Darth Vader from Yisus,Resurrección,Gon Caturelli,Feb,2022,https://www.instagram.com/p/CZ5RlXfjAnA/,YISUS,EXPOSURE,-1,We haven't figured out yet what's going on here. Look at the video and help us by updating the description.,,,,,,FALSE,10132
Antihero from Yisus,Anticristo,Gon Caturelli,Jan,2022,https://www.instagram.com/p/CZPRbnNKCZ4/,YISUS,SOFA,-1,We haven't figured out yet what's going on here. Look at the video and help us by updating the description.,,,,,,FALSE,10039
Orbital from Chest to Feet,Onda,Cesare Bellamoli,Apr,2022,https://youtu.be/eUguTccJblI?t=23,CHEST,EXPOSURE,6,We haven't figured out yet what's going on here. Look at the video and help us by updating the description.,,,,,,FALSE,10283
90 Korean Roll to Expo,FireFly,Samuel Volery,Oct,2021,https://www.instagram.com/p/CVQIDtpAbme/,KOREAN,EXPOSURE,5,"Start the same way as you would for the Fireflip, but go directly to Expo without doing the 180.",,,,,,FALSE,10100
Sick Nasty to Yisus,Nasty Christo,Gon Caturelli,Sep,2022,https://www.instagram.com/p/CjGFSHejhqn/,SOFA,YISUS,-1,We haven't figured out yet what's going on here. Look at the video and help us by updating the description.,,,,,,FALSE,10044
Makako 180 to Feet,Darthkako,Sakalomo,Jan,2022,https://youtu.be/Ej2ocABoNC4?t=21781,NEVERMIND,EXPOSURE,-1,"From Nevermind start with the normal Makako motion but as soon as you regrab the line with your hands, do an additional 180 before coming back to Exposure. The last part of the trick is like a Darth Vader, hence the name.",,,,,,FALSE,10159
Fake 180 Barrel Roll,,Samuel Volery,,,https://youtu.be/rWqH_51ztQA?t=11530,STAND,STAND,7,This is a 180 Barrel Roll without restepping. This means you either start or land the trick in your switch stance.,,,,,,FALSE,10122
Orbital to Feet,,,,,https://www.instagram.com/p/CLowqcjlipw/,STAND,STAND,7,On the way up in the bounce grab the line with one hand and bring it over your head. From there grab the line with your other hand and bring it back down to put your feet on.,,,,,,TRUE,
Flow to Feet,,,,,,KOREAN,STAND,5,From Korean you grab the line with both hands behind you and then swing your far leg over the line. From there aim to land on the line with both feet to finish the trick.,,,,,,TRUE,
Expo 360 to Back Yoda Roll,Yodel Roll,Tim Odermatt,Apr,2022,https://www.instagram.com/p/CcdNbmCAWsw/,EXPOSURE,EXPOSURE,8,From Exposure do a 360 and grab the line. Then go into a Back Yoda Roll.,,,,,,TRUE,
Nevermind 360,,Tim Odermatt,May,2022,https://www.instagram.com/p/CeCNKq5Fqyc/,NEVERMIND,STAND,7,From Nevermind go up spinning frontside 360 and land back in your normal stance.,,,,,,TRUE,
Neverending Yoda Rolls,Infinity,Tim Odermatt,Jan,2022,https://www.instagram.com/p/CYcI_IRAxQK/,EXPOSURE,EXPOSURE,9,Start out as you would for a one bounce Yoda Roll but then keep rolling. Never stop!,,Tim invented this trick when going for a one bounce Double Back Yoda Roll.,,,,FALSE,
Double Back Han Solo,,Tim Odermatt,Jun,2022,https://www.instagram.com/p/CejUEcrlg2K/,EXPOSURE,EXPOSURE,8,Similar to a Double Back Yoda Roll but grabbing the leash instead of the line.,,,,,,TRUE,
Can of Soup to Backflop,Soup Backflop,Tim Odermatt,Jun,2022,https://www.instagram.com/p/Ce8WJ4YlvTr/,SOUP,KOREAN,8,Do a Can of Soup into a Backflop in the same bounce.,,,,,,TRUE,
Backflip Late 180,,Tim Odermatt,Jul,2022,https://www.instagram.com/p/CgZsOA1l2eG/,STAND,STAND,9,Do a Backflip but then passing Exposure you add a 180 before landing the trick.,,Think about landing the normal Backflip in switch so when you add the 180 you are back in your normal stance.,,,,FALSE,
Barrel Roll to Backflop,Barrelflop,Tim Odermatt,Jul,2022,https://www.instagram.com/p/Cge6C4VFUPm/,STAND,KOREAN,8,Do a Barrel Roll and add a late Backflop.,,,,,,TRUE,
Double Back Yoda Roll 180,Yodermatt,Tim Odermatt,Aug,2022,https://www.instagram.com/p/Ch8Ca0GPEOG/,EXPOSURE,EXPOSURE,9,Double Back Yoda Roll with a 180 in the second Roll.,,,,,,TRUE,
NH Shapeshifter to Feet,Legolas,Tim Odermatt,Sep,2022,https://www.instagram.com/p/Ci5NrdeJqa6/,EXPOSURE,EXPOSURE,9,Jump into the leash doing a frontflip from Exposure then use your foot to step into the leash and then back on the line.,,,,,,FALSE,
Triple Front Yoda Roll,,Emil Breuer,Jul,2022,https://www.instagram.com/p/Cf6TRhogHtO/,EXPOSURE,EXPOSURE,9,Three Front Yoda Rolls in one bounce.,,,,,,TRUE,
Back Almighty from Nevermind,Nevermighty,Emil Breuer,Jul,2022,https://www.instagram.com/p/CggrqR7gV5j/,NEVERMIND,EXPOSURE,7,Start like a normal Nevermind but then push into the line with the foot that is already on the line to create momentum into a back roll. Use your second foot to hook the line and finish with a Back Almighty.,,,,,,TRUE,
Triple Shoulder Roll,Vortex ,Lucas clemente Pereira ,Dec,2021,https://www.instagram.com/tv/CYTUaA5uwWa/,SHOULDER,SHOULDER,9,Ter o double sholder roll na base ,,Executar com muita força ,,,,TRUE,
Sushi Backflip,Sushi-Flip,Ian Eisenberg,Aug,2022,https://www.instagram.com/p/Cg8_eXWLmXw/,STAND,STAND,10,Start with an early Sushi and add a Backflip to it,,,,,,FALSE,
No-Hands Backflip,,Ian Eisenberg,Aug,2022,https://www.instagram.com/p/Cg_eTDJLsZ6/,STAND,STAND,9,Like a regular Backflip but without using your hands.,,,,,,FALSE,
Backbounce Roll Half Spiral to Feet ,Chill,Sakalomo,Jan,2022,https://www.instagram.com/reel/CY6eIm2K4_M/,BACK,STAND,6,"Start from backbounce and grab the line with one hand. Before the top of the bounce throw yourself to the side of the hand that grabs the line. Do a roll below the line, take with both hands and put your feet. ",,Timing is key. When you throw yourself think of kicking up with your knees/feet to initiate the rotation.,,,,TRUE,
BS 360 Rocket Mount,,Ian Eisenberg,Aug,2022,https://www.instagram.com/p/ChPQYxLMAMA/,ROCKET,EXPOSURE,7,Rocket Mount with a 360 spinning to your backside.,,,,,,FALSE,
Rocket Line Bite,Sharkbite,Ian Eisenberg,Aug,2022,https://www.instagram.com/p/ChsA7RvrV7m/,ROCKET,ROCKET,4,From Rocket you pull yourself up so you're able to bite the line and let go with the hands. Then grab the line again and drop back to Rocket.,,Watch out to not bite your lips,,,,FALSE,
Makako to Feet Roll ,Gorilla,Sakalomo,Aug,2022,https://www.instagram.com/reel/ChH21QWAYmw/,NEVERMIND,EXPOSURE,10,Do a makako to feet and add an extra back yoda roll,,,,,,TRUE,
360 Rocket (over Bat-Hang),Batman,Ian Eisenberg,Aug,2022,https://www.instagram.com/p/ChsA7RvrV7m/,ROCKET,ROCKET,5,"You drop to Rocket slightly uncentered such that you can get some momentum by swinging to one side. From there you use the momentum to swing your legs to the other side and all the way up to hook the line with both feet (the Bat-Hang position), you let go with your hands and do a 360 under the line by regrabbing the line on the other side of your feet. Unhook your feet and land back in Rocket.",,,,,,FALSE,
Double Darth Vader,,Justin Wagers / Ian Eisenberg,Aug,2022,https://www.instagram.com/p/ChsjejWLu8d/,ROCKET,EXPOSURE,10,It's a Darth Vader with an extra roll.,,,,,,TRUE,
Backbounce Back Almighty ,Backalomo,Sakalomo,Oct,2022,https://www.instagram.com/reel/Cj0cYssPTO2/,BACK,EXPOSURE,9,"Do a backbounce, when you stand up hook your foot under the line to do a back almighty.",,,,,,FALSE,
Darkside Almighty,All-Nasty,Ian Eisenberg,Aug,2025,https://www.instagram.com/p/Chxgwo6s6g_/,SOFA,EXPOSURE,8,It's a Darkside Roll but you let go with the hands while you're doing the trick and hook with one foot to finish the trick like a Back Almighty.,,,,,,FALSE,
Back Shapeshifter ,A Chuparla,Sakalomo,Oct,2022,https://www.instagram.com/reel/CkGq5w3unmy/,EXPOSURE,ROCKET,6,"Bounce hard, almost at the top of the bounce throw yourself backwards and do a backflip without touching the line. Put your hands up and grab the line to end in the rocket position.",,,,,,FALSE,
Chill to Shoulder ,Sakalhombro,Sakalomo ,Dec,2022,https://www.instagram.com/reel/Cmg1feNqD52/,BACK,SHOULDER,7,Do a chill but instead of landing on your feet go to shoulder.,,,,,,FALSE,
540 Rocket to Sofa,,Ian Eisenberg,Aug,2022,https://www.instagram.com/p/Ch11yrdsUEG/,ROCKET,SOFA,6,540 from Rocket to Sofa.,,,,,,FALSE,
Backside Orbital to Feet,Eclipse ,Sakalomo,Jan,2023,https://www.instagram.com/reel/CnPMRSyDbqI/,STAND,STAND,8,Just like an orbital to feet but throw the line to your backside. Land on your feet.,,Timing is key when throwing the line.,,,,TRUE,
FS 360 Back Almighty,,Ian Eisenberg,Sep,2022,https://www.instagram.com/p/Ch99aJdpyUo/,STAND,STAND,8,Start with a frontside spin and then transition into the Back Almighty,,,,,,FALSE,
Chill to darth Vader ,Chillin Vader,Sakalomo,Jun,2023,https://www.instagram.com/reel/CuSHxPyt1Or/,BACK,EXPOSURE,8,"Go to backbounce, do a chill but instead of going directly to feet do a darth vader motion to end in expo.",,,,,,TRUE,
Nevermind Panic Roll to Feet ,Never Panic ,Sakalomo,Sep,2023,https://www.instagram.com/reel/Cw2TcR2MYwg/,NEVERMIND,EXPOSURE,7,Go to nevermind position. When you go up the bounce cross your foot and start a panic roll. Grab the line with both hands and put your feet.,,,,,,FALSE,
180 Backbounce Back Almighty,180 Backalomo,Sakalomo,Sep,2023,https://www.instagram.com/reel/Cxz3jG-MvFX/,BACK,EXPOSURE,9,"Do a backbounce, when you go up hook your foot on the line and start a back almighty and when you are upside down start a 180 motion, en in feet.",,,,,,FALSE,
Reverse Rocket to Almighty,Reverse Supermighty,Sakalomo,Sep,2023,https://www.instagram.com/reel/Cxz3jG-MvFX/,ROCKET,EXPOSURE,9,Do a reverse súper sonic but instead of doing a back yoda roll do a back almighty ,,,,,,FALSE,
Double Supersonic,,Sakalomo,Oct,2023,https://www.instagram.com/reel/Cx_HE9SsTFX/,ROCKET,EXPOSURE,10,"Go to rocket, kick with your feet to start a super sonic and add an extra front yoda roll.",,,,,,TRUE,
Makako to Feet from Rocket ,Rockako,Sakalomo,Oct,2023,https://www.instagram.com/reel/Cx_HE9SsTFX/,ROCKET,EXPOSURE,10,"Go to rocket, then kick like you would for a Makako, rotate to land on your feet. Quite similar to Shrimpzilla.",,,,,,FALSE,
Makako Feet to Feet ,King Kong,Sakalomo,Jan,2024,https://www.instagram.com/reel/C2XluUNMUEV/,STAND,EXPOSURE,10,"With a big bounce , grab the line while starting a roll backwards and from there kick like you would on a Makako. Put both feet on the line to land in expo ",,,,,,TRUE,
180 Space Eclipse to Sofa ,,Sakalomo ,Sep,2024,https://www.instagram.com/reel/C_p2waaMiEy/,STAND,SOFA,8,"Do a eclipse bot don’t use your hands to move the line, let the high tension bring the line back down and go to sofa.",,"You need the right setup, some bungees and a lot of tension on the line.",,,,FALSE,
Darth Vader from Shoulder,Shoulder Vader,Ian Eisenberg,Mar,2023,https://www.instagram.com/p/CpSmWVMNfNC/,SHOULDER,EXPOSURE,8,From Shoulder you initiate a Back Shoulder Roll but then you quickly let go with the far hand and turn more sideways. From there you finish with a Darth Vader.,,,,,,TRUE,
Space Front Almighty,Impossible,Sakalomo,Sep,2024,https://www.instagram.com/reel/C_p2waaMiEy/,EXPOSURE,EXPOSURE,10,"Do a front almighty but don’t use the foot to hook, just push the line to the side,  do the front flip and almost at the end of the rotation put your feet again to land in exposure.",,You need the right setup. Some bungees and a lot of tension in the line.,,,,TRUE,
180 Sick Nasty Roll,Freak Nasty Roll,Ian Eisenberg,Apr,2023,https://www.instagram.com/p/CrJd3OYPBmz/,SOFA,SOFA,7,Start with a Sick Nasty but add a 180 spin and finish with a Sick Nasty Roll,,,,,,TRUE,
Space Eclipse to DDK,,Tim Odermatt ,Sep,2024,https://www.instagram.com/reel/C_p2waaMiEy/,STAND,DOUBLE DROP KNEE,10,"Do a eclipse but don’t touch the line with your hands, once the line goes around you land on DDK",,You need the right setup. Some bungees and a lot of tension.,,,,FALSE,
Space Eclipse ,,Sakalomo,Sep,2024,https://www.instagram.com/reel/C_p2waaMiEy/,STAND,STAND,10,Do an eclipse but don’t touch the line with your hands. Once the line goes around out your feet again. The timing of the kick is key.,,,,,,TRUE,
180 Boomerang to Feet,Nerd Flip,Ian Eisenberg,May,2023,https://www.instagram.com/p/CsL-QT4ucWR/,SOFA,EXPOSURE,9,Start with a normal Boomerang but instead of finishing it with a Sick Nasty Roll you finish it with a Rubiks Cube.,,,,,,TRUE,
Darth Vader from DDK,Kneisenvader,Ian Eisenberg,May,2023,https://www.instagram.com/p/Cslw6UhMg6d/,DOUBLE DROP KNEE,EXPOSURE,8,From Double Drop Knee Roll to the front until you are in the Rocket position and then use the momentum to finish with a Darth Vader,,,,,,FALSE,
Supersonic to Darth Vader,Supervader,Ian Eisenberg,Jul,2023,https://www.instagram.com/p/CuPrkp_Psrw/,ROCKET,EXPOSURE,9,Supersonic to Darth Vader... Not much else to say here!,,,,,,TRUE,
360 Supersonic,,Ian Eisenberg,Jul,2023,https://www.instagram.com/p/C-GAIBNskkO/,ROCKET,EXPOSURE,9,Supersonic with a 360.,,,,,,TRUE,
Darthkako Roll,Sauron,Sakalomo,Oct,2024,https://www.instagram.com/reel/DA8FTrJs5jp/,NEVERMIND,EXPOSURE,10,"Go to nevermind, from there start a darth kako, on mice you get the roll add another yoda roll. Land in exposure",,,,,,TRUE,
Space Sakalorbital,,Sakalomo,Oct,2024,https://www.instagram.com/reel/DBllnO2shH7/,STAND,STAND,10,"Do a sakalorbital by kicking the line almost at the highest point of the bounce, rotate 180 let the line go around you and land again on your feet. ",,,,,,,
FS 540 Back Almighty,,Ian Eisenberg,Jul,2023,https://www.instagram.com/p/CvUuGMUruQ3/,STAND,STAND,9,Just watch the video.. It's hard to describe :D,,,,,,,
