Technical name,Name,Original performer,monthEstablished,yearEstablished,linkToVideo,Start position,End position,Difficulty,description,descriptionEs,tips,tipsEs,recommendedPrerequisites,dateAdded,isImportant,isVariationOf
Sofa Roll,,Samuel Volery,,2016,https://www.youtube.com/watch?v=Ugw1gRm-T0U,SOFA,SOFA,1,"Sit in Sofa, grab the line with both hands and press the line against your butt/thighs. Then throw yourself forward or backward, initiating the roll. To stop the roll, extend your legs.","Siéntate en sofá, agarra la línea con ambas manos y presiona la línea contra tu culo. A continuación, déjate caer hacia atrás.",Leash to the side can help prevent bad falls; If you fall into a backlever position let go of the line in order to save your shoulders; You can practice this trick with a hangover clipped in to save energy and get familiar with the movement without fear of falling badly,"La correa a un lado puede ayudar a prevenir las malas caídas; si se cae en una posición de espalda, suelte la línea para salvar sus hombros.",,1 Jan 2022,TRUE,
Belly Roll,,,,,https://youtu.be/ksF8g5YrXY8?t=230,BELLY,BELLY,1,With both hands on the line supporting your weight you lie on your belly and roll forward (or backward) around the line.,"Con las dos manos en la línea soportando tu peso, te tumbas sobre el vientre de manera perpendicular y ruedas hacia delante alrededor de la línea.",You can try this trick clipped into the hangover first to save energy while familiarizing yourself with the movement.,,,1 Jan 2022,TRUE,
Chest Roll,,,,,https://youtu.be/ksF8g5YrXY8?t=182,CHEST,CHEST,1,"From lying on your chest get some momentum with your free arm and leg, hook the line with one foot and then roll around the line grabbing it with both hands. Land back in chest.",Desde el pecho toma impulso con la pierna libre y luego rueda alrededor de la línea agarrándola con ambas manos. Aterriza de nuevo en el pecho.,"You can wrap the foot around the line to avoid falling away from the line. Alternatively, you can press it against the line from below; You can try this trick clipped into a hangover at first to familiarize yourself with the movement.",Puede envolver el pie alrededor de la línea para evitar que se caiga de la línea.,,1 Jan 2022,TRUE,
Korean Roll,,,,,https://youtu.be/ksF8g5YrXY8?t=135,KOREAN,KOREAN,1,"Sit in Korean, grab the line with one hand in front of you and one hand behind you and let yourself fall to the side. Land back in Korean.","Siéntese en Korean, agarre la línea frente a usted con ambas manos y déjese caer hacia un lado.","Start the movement while the line moves upwards; You can try this trick clipped into a hangover first; Sometimes called ""Harry Potter Roll""","A veces llamado ""Rollo de Harry Potter""",,1 Jan 2022,TRUE,
Sofa 270 to Korean,Panic,,,,https://www.youtube.com/watch?v=12HbVhoFloM,SOFA,KOREAN,1,"From Sofa you start a 180 FS spin, grab the line on your side with both hands and swing the far leg over the line to land in Korean.",Desde el Sofá agarras la línea de tu lado con ambas manos mirando hacia el mismo lado. Si vas a la izquierda quieres balancear tu pierna derecha sobre la línea haciendo un 270 (180 si empiezas desde Butt) aterrizando en coreano.,Keep your center of gravity above the line.,Es un rollo de pánico sin el rollo.,,1 Jan 2022,TRUE,
Hammock Roll,,Samuel Volery,,2016,https://www.youtube.com/watch?v=maY2RjAJs1g,BACK,BACK,2,Lie on your back and grab the line behind your head with both hands. Hook one foot under the line and roll around the line landing again in Backbounce.,Túmbate de espaldas y agarra la línea por detrás de la cabeza con ambas manos. Engancha un pie bajo la línea y rueda alrededor de la línea aterrizando de nuevo en Backbounce.,"As soon as you rotated all the way, let go with your hands and put your arms to the side to stop the roll. Letting go of the line feels counterintuitive, but it really helps to land the trick.",,,1 Jan 2022,TRUE,
Sofa 270 Korean Roll,Panic Roll,Jediah Doohan,,,https://www.youtube.com/watch?v=12HbVhoFloM,SOFA,KOREAN,2,Sit in Sofa position grab the line to the side of you with hands facing behind you. On the way up in the bounce dive down where your hands are and roll around the line. Land in Korean or Chest. Essentially you perform a 270 spin combined with a roll around the line.,"Siéntate en posición de sofá y agarra la línea a tu lado con las manos mirando hacia atrás. Al subir, sumérgete donde están tus manos y rueda alrededor de la línea. Aterriza en coreano o en pecho.",It helps to separately practice the spin of the leg (Panic) and the roll around the line and then work to combine both at the same time.,,10225,1 Jan 2022,TRUE,
Side Sofa Roll,Utinni Roll,Michele Eibeck,,2021,https://www.instagram.com/p/CNYQEb4Jt1M/,SOFA,SOFA,2,Start in Sofa. Both hands next to you (right or left) holding on to the line. Then do a Sofa Roll with your body leaning towards the line where your hands are. To land the trick put the hands back to normal as you would when sitting in Sofa.,Comienza en el sofá. Las dos manos a tu lado (derecha o izquierda) sujetándose a la línea. Luego haz un Sofa Roll con tu cuerpo inclinado hacia la línea donde están tus manos.,,Manténgase pequeño y compacto durante el rodaje.,10005,1 Jan 2022,FALSE,10005
Sofa Roll from Korean,Richy Roll,Richard Schupisser,,,https://youtu.be/7kZjIAVYoyY?t=161,KOREAN,SOFA,2,From Korean swing one leg over the line and immediately after you start the leg swing initiate a roll to finish as a Sofa Roll.,Desde korean déjate caer hacia un lado e inmediatamente después de empezar el roll balancea una pierna sobre la línea para terminar el rollo como un sofa-roll,Be comfortable with Sofa Rolls first.,,10005,1 Jan 2022,TRUE,
Back Korean Roll to Sofa,,Sakalomo,,2021,https://youtu.be/7yLCyoHgUS0?t=783,KOREAN,SOFA,3,"Do a Back Korean Roll with both hands in front. During the roll, pass the front leg between you and the line to land in Sofa. ",Inicia el movimiento de un back korean roll pero pasa una pierna por delante para terminar en sofa al final del roll,,,,1 Jan 2022,FALSE,10011;10003
Expo Buddha Roll,,Eli Ellis,,2020,https://youtu.be/hsALSrUdryU?t=29,BUDDHA,BUDDHA,-1,"Sit in Expo Buddha, grab the line both hands on the sides, roll around the line, land again in Expo Buddha.","Roll con las piernas cruzadas en forma de buda , una mano alante y otra atras. si es en expo una mano a cada lado ",,,,1 Jan 2022,FALSE,10005
Fake 360 Korean Roll,Flowflip,,,,https://youtu.be/12HbVhoFloM?t=199,KOREAN,CHEST,2,"From Korean, combine a 360 spin with a Korean roll around the line. Either start or land in Switch Korean. Similar to a Panic Roll but you start from Korean turned 90 further away to where you want to go.","Es similar a un panic roll, pero empiezas desde korean girado 90 más lejos de donde quieres ir.",Learn how to do a Panic Roll first. Then think of it as a Panic Roll from Korean.,Agarra la línea a tu espalda y déjate caer hacia atrás. El resto ocurre por arte de magia.,10000;10224,1 Jan 2022,TRUE,
Panic Roll to Sofa,,Salomé Cholet,,2021,https://youtu.be/7yLCyoHgUS0?t=491,SOFA,SOFA,3,Do a Panic Roll but before you land throw your second leg on the other side of the line as well to land back in Sofa.,Haz un panic roll pero antes de aterrizar lanza tu segunda pierna al otro lado de la línea también para aterrizar de nuevo en Sofá.,,,10000,1 Jan 2022,FALSE,10000
Backbounce to Chest Roll,,,,,https://www.youtube.com/watch?v=ih6Rx-UpBfw&t=478,BACK,CHEST,2,From Backbounce move forward like you are going to Chest but add a Chest Roll.,Desde el Backbounce muévete hacia delante como si fueras a hacer Chest pero añade un Chest Roll.,,,10007,1 Jan 2022,FALSE,10007
Backbounce Panic Roll,,,,,https://www.youtube.com/watch?v=LPsuhcOZd0Q,BACK,KOREAN,3,From Backbounce swing one leg to other side and then perform a Panic Roll in the opposite direction. ,Desde el Backbounce gira una pierna hacia un lado y rueda alrededor de la línea del otro lado para realizar un Panic Roll.,,,10000,1 Jan 2022,FALSE,10000
Double Hammock Roll,,,,,https://youtu.be/Ej2ocABoNC4?t=19688,BACK,BACK,3,Two Hammock Rolls in one bounce.,Dos hammok roll en un solo rebote.,,,10004,1 Jan 2022,FALSE,10004
Back Roll Twist,,,,,https://youtu.be/rWqH_51ztQA?t=3487,BACK,KOREAN,3,"While doing the second half of a Back Roll, also turn once around the line, so do a Back Roll with a Korean Roll at the end.",Esto suele ocurrir cuando se intenta hacer un Back Roll normal con un mal timing (demasiado temprano),"For some people, this happens automatically when they try a Back Roll with bad timing. If you're not one of those, try adding a Korean Roll in the second half of the Back Roll.",,,1 Jan 2022,FALSE,10047
Korean 270 Spin to Back Belly Roll,Underflip,Augustin Moinat,,2021,https://youtu.be/7kZjIAVYoyY?t=45,KOREAN,BELLY,2,Spin with one leg 270 degrees from Korean to Belly into a Back Belly Roll.,Gira como si hicieras un flowflip (sin roll) pero luego termina con un giro de vientre hacia atrás.,Be comfortable with Back Belly Rolls first; Start the spin with the intention of finishing as a Back Belly Roll.,,10006,1 Jan 2022,TRUE,
Sit to Feet,,,,,https://www.youtube.com/watch?v=rdV2Jhi6U5Y,SIT,STAND,2,"From Sit you stand up on the top of the bounce. If you don't have enough momentum, you can pull on the line with one arm.","Desde Sit te levantas en la parte superior del rebote. Si no tienes suficiente impulso, puedes tirar de la línea con un brazo.",Learning this is a lot about learning the correct timing which is doing the trick at the top of the bounce when you feel weightless.,,,1 Jan 2022,TRUE,
Korean Bounce,,,,,https://www.youtube.com/watch?v=1hPL5d3en8c,STAND,KOREAN,2,From standing on the line you let the line come towards your body on the top of the bounce and then slide your feet off the line to land in Korean.,"Desde la línea de pie, dejas que la línea se acerque a tu cuerpo en la parte superior del rebote y luego deslizas tus pies fuera de la línea para aterrizar en el coreano.",,,,1 Jan 2022,TRUE,
Chest Bounce,,,,,https://www.youtube.com/watch?v=Z11fkcCv_Qo,STAND,CHEST,2,On the way to the top of the bounce you let the line come towards your body and grab it with one hand. Slide your front foot off the line and with your hand controlling the line you drop down to chest.,En el camino hacia la cima del rebote dejas que la línea venga hacia tu cuerpo y la agarras con una mano. Desliza el pie delantero fuera de la línea y con la mano que controla la línea te dejas caer sobre el pecho.,It can help to practice briefly grabing the line at the top of the bounce while bouncing in normal to learn to let the line come to you instead of you droping down to the line.,,,1 Jan 2022,TRUE,
Soup to Feet,,,,,https://www.youtube.com/watch?v=-xz9Ex3IE-M,SOUP,STAND,2,"From Soup you stand up on the top of the bounce. If you don't have enough momentum, you can pull the line with one arm.","Desde Soup te pones de pie en la parte superior del rebote. Si no tienes suficiente impulso, puedes tirar de la línea con un brazo.",,,10184,1 Jan 2022,TRUE,
Soup Bounce,,,,,https://www.youtube.com/watch?v=-xz9Ex3IE-M,STAND,SOUP,2,From standing on the line you let the line come towards your body on the top of the bounce and sit down keeping one foot on the line.,De pie en la línea dejas que la línea venga hacia tu cuerpo en la parte superior del rebote y te sientas manteniendo uno de tus pies en la línea.,Feels like sitting down on something behind you; Don't try to grab the line in case you loose the balance; It can help to practice Korean bounces first and then Soup bounces.,,10185,1 Jan 2022,TRUE,
180 Chest Roll from Korean,Mini-Fireflip,Salomé Cholet,,2021,https://youtu.be/rWqH_51ztQA?t=14839,KOREAN,KOREAN,2,From Korean grab the line behind you and go into a Front Chest Roll. Land back in Korean looking at the other anchor.,Desde el coreano agarra la línea detrás de ti y haz un Front Chest Roll. Aterriza de nuevo en coreano mirando al otro ancla.,,,,1 Jan 2022,TRUE,
Korean 360,Flow,,,,https://www.youtube.com/watch?v=12HbVhoFloM,KOREAN,KOREAN,2,From Korean you grab the line with both hands behind you and then swing your far leg over the line twice to do a 360 landing back in Korean.,Desde el coreano agarras las manos mirando hacia el mismo lado en la línea detrás de ti y luego balanceas tu pierna más lejana sobre la línea dos veces para hacer un 360 aterrizando de nuevo en el coreano.,Practice the same movement from Sofa first (= Panic).,Es un Flowflip sin el rollo alrededor de la línea.,10225,1 Jan 2022,TRUE,
Back Sofa Roll from Korean,Back Richy Roll,Richard Schupisser,,,https://youtu.be/7kZjIAVYoyY?t=203,KOREAN,SOFA,2,From Korean let yourself fall to the side and immediately after you start the roll swing one leg over the line to finish the roll as a Back Sofa Roll.,,,,,,FALSE,10003
Petit Trick,,Salomé Cholet,Feb,2022,https://youtu.be/Nk-wk2kYRso?t=109,KOREAN,KOREAN,3,"From Korean, grab the line in front of you with both hands. Shift your weight onto your arms, swing one leg over the line and start bringing it to the front. Lean backwards, release your front hand and swing the same leg as before back over the line. Finish sitting in Korean.",,,,,,TRUE,
Backbounce Richy Roll,,,,,https://www.youtube.com/watch?v=uuFlRIMmP8M&t=199,BACK,SOFA,3,From Backbounce get back up into Korean and in one fluid motion kick one leg over the line to go into a Sofa Roll.,Desde el Backbounce vuelve a subir a korean y en un movimiento fluido patea una pierna por encima de la línea para pasar a un Sofa Roll.,Start the motion of getting up from Backbounce to Korean really early in the upward motion of the line.,,10003,1 Jan 2022,FALSE,10003
Sofa Roll 360,,Anthony Boulay,,,https://www.youtube.com/watch?v=ekkrE58S4O8,SOFA,SOFA,4,Start a Belly Roll from Sofa and add a 180 at the end.,Empieza como si hicieras un panik roll pero al final saca el culo y aterriza en Sofá.,,,10222,1 Jan 2022,TRUE,
Hammock Roll from Feet,,Augustin Moinat,,2021,,STAND,BACK,5,"Let the line come to your butt and grab it right behind your butt with one hand and then go to Backbounce, grab the second hand behind your head, hook with one foot and do a Hammock Roll. ",Rueda hacia abajo a Backbounce desde pie .,,,10004,1 Jan 2022,FALSE,10004
Back Roll Twist from Feet,Escoba Roll,Sakalomo,,2021,https://www.instagram.com/p/CMm5lqolNs4/,STAND,CHEST,-1,Do a Back Roll from Feet but with a roll around the line as well.,Haz un voltereta hacia atras  desde los Pies pero con un roll alrededor de la línea también.,,,,1 Jan 2022,FALSE,10086
Back Korean Roll BS 180,Richard Roll,Sakalomo,,2021,https://youtu.be/7yLCyoHgUS0?t=694,KOREAN,KOREAN,4,"Do a Back Korean Roll, pass the front leg over the line to be in Sofa, pass the back leg over the line to end in Korean facing the other anchor.",Haz un Rollo Coreano de Espalda pero las piernas se alejan de la línea para girar 180 y aterrizar de nuevo en coreano mirando al otro ancla.,,,,1 Jan 2022,FALSE,10170
Nevermind BS 360 to Chest,Spiral,Sakalomo,,2021,https://youtu.be/7yLCyoHgUS0?t=752,NEVERMIND,CHEST,4,Do a Nevermind up but instead of going to Feet you spin 360 backside and land in Chest.,Haz una subida de Nevermind pero en vez de ir a Pies giras 360 y aterrizas en Pecho.,,,,1 Jan 2022,FALSE,10036
Double Double Drop Knee Roll,,Davis Hermes,,2021,https://youtu.be/VP49hErTqM0?t=125,DOUBLE DROP KNEE,DOUBLE DROP KNEE,-1,Double Roll in Double Drop Knee.,Doble rodillo en la rodilla de doble caída.,,,,1 Jan 2022,FALSE,10281
Inward Drop Knee Spin to Front Sofa Roll,,Davis Hermes,,2021,https://youtu.be/VP49hErTqM0?t=97,INWARD DROP KNEE,SOFA,-1,"Start from Inward Drop Knee, take the front foot off the line to spin 270 to go into a Front Sofa Roll.",Comienza desde la rodilla caída hacia adentro y gira 270 para entrar en un rollo de sofá frontal.,,,,1 Jan 2022,FALSE,10005
Sick Nasty to Chest,Nasty Chest,Eli Ellis,,2020,https://www.instagram.com/p/CJeCTdHBaUn/,SOFA,CHEST,3,Sick Nasty landing in Chest.,Sick Nasty aterrizando en el pecho.,,,,1 Jan 2022,FALSE,10044
Sick Nasty to Chest Roll,Nasty Chest Roll,Eli Ellis,,2020,https://www.instagram.com/p/CJeCTdHBaUn/,SOFA,CHEST,4,Sick Nasty to Chest Roll.,Rollo de la enfermedad en el pecho.,,,,1 Jan 2022,FALSE,10044
Half Back Roll,,Guillaume Fontaine,,2017,https://www.youtube.com/watch?v=O_E_2cB0Pcw&t=4,BACK,SHOULDER,4,From Backbounce do a Back Roll but stop in Shoulderstand.,Desde el Backbounce haz un Back Roll pero detente en el Shoulderstand.,,,10047,1 Jan 2022,FALSE,10047
FS 360 to Chest,Dirty Bastard,Ian Eisenberg,,2021,https://www.youtube.com/watch?v=A8O3iGYGPPk&t=39,STAND,CHEST,4,From standing do a 360 spin and land in Chest.,Desde la posición de pie se gira 360 y se aterriza en Pecho.,,,,1 Jan 2022,FALSE,10228
Antihero,,Ian Eisenberg,,2020,https://youtu.be/V0fMaONFvVY,ROCKET,SOFA,4,"Starting from Rocket, initiate a frontflip motion and let go of one hand, bring both legs over the line to land in Sofa.",Antihéroe pero aterrizando en Sofá.,,,,1 Jan 2022,TRUE,
NH Korean Roll from Feet,California Roll,Ian Eisenberg,,2020,https://youtu.be/T27UrrWAr7A,STAND,KOREAN,-1,From standing let the line come to your kneepit and roll to the side landing in Korean.,Desde la posición de pie deja que la línea llegue a tu rodilla y rueda hacia el lado aterrizando en coreano.,,,,1 Jan 2022,FALSE,10114
Rocket Mount to Sofa,,Samuel Volery,,2017,https://youtu.be/hsALSrUdryU?t=73,ROCKET,SOFA,4,From Rocket pull yourself up and then swing the legs over the line in a Sick Nasty motion. You have to let go off the line with one hand so your legs can pass to land in Sofa. Alternatively you can also thread both legs in between your arms and the line to go to Sofa.,Desde la mosca colgante hasta el sofá.,,,,1 Jan 2022,FALSE,10067
Triple Hammock Roll,,Tlaloc Moctezuma-Burns,,2020,https://www.youtube.com/watch?v=Se5XNo0RSP8&t=557,BACK,BACK,-1,Three Hammock Rolls in one bounce.,Tres rollos de hamaca en un solo rebote.,,,,1 Jan 2022,FALSE,10004
Back Roll from Back to Back,Back Magic,,,,https://www.youtube.com/watch?v=-HEZdGIakVQ,BACK,BACK,3,Back Roll directly into Backbounce.,Rollo de espalda directamente en Backbounce.,,,10047,1 Jan 2022,FALSE,10047
Back Roll from Back,,,,,https://youtu.be/9pi0GYhBvdo?t=13,BACK,KOREAN,2,Choose a shoulder that you will roll over to do this trick and put the leash on the side of this shoulder. From Backbounce wait until you are at the very top of the bounce and then pull yourself back over the shoulder and land in Korean.,Desde el Backbounce tira hacia atrás por encima del hombro y aterriza en coreano.,Have the leash on the same side as the shoulder you roll over.,Tenga la correa en el mismo lado que el hombro sobre el que rueda.,,1 Jan 2022,TRUE,
Half Front Roll,,,,,,SHOULDER,KOREAN,3,"Arrange the leash such that it's hanging down on the side of the shoulder that you are doing the shoulderstand from. Start with the shoulderstand and wait until you're at the top of the bounce. Then push yourself to the front by pushing with your hands off of the line, roll over your back and finish the trick by landing in Korean.",Desde la parada de hombros rueda sobre tu espalda para aterrizar en coreano.,If you are on the right shoulder try to thread your right arm through the leash so you don't end up with the leash stuck on your shoulder.;Often you will slightly overrotate this trick and it can help to grab with both hands in front of you to stop the momentum.,"Si está en el hombro derecho, intente pasar el brazo derecho por la correa para no acabar con la correa atascada en el hombro.",,1 Jan 2022,TRUE,
Makako,,Sakalomo,,2021,https://youtu.be/44gWgvZrso4,NEVERMIND,BELLY,3,"Hang in Nevermind, thread the leg that is free through your leg and the closer arm and kick through to go to a Back Belly Roll.",Colócate en Nevermind pero con las manos opuestas. Enhebra la pierna que está libre a través de tu pierna y el brazo más cercano y da una patada para pasar a Back Belly Roll.,,,,1 Jan 2022,TRUE,
Belly to Feet,,,,,,BELLY,EXPOSURE,3,"From Belly lift one foot up on the line, remove the hand on the same side to help you balance and then press the line down with this foot and the other hand to get the second foot up.","Desde el vientre levanta un pie en la línea, saca la mano del mismo lado para ayudarte a equilibrar y luego presiona la línea hacia abajo con este pie y la otra mano para levantar el segundo pie.",,,,1 Jan 2022,TRUE,
Sofa to Feet,,,,,https://www.youtube.com/watch?v=_CqGa-iBrHE,SOFA,EXPOSURE,3,"From Sofa lift one foot up on the line, remove the hand on the same side to help you balance and then press the line down with this foot and the other hand to get the second foot up.","Desde el sofá levanta un pie en la línea, saca la mano del mismo lado para ayudarte a equilibrar y luego presiona la línea hacia abajo con este pie y la otra mano para levantar el segundo pie.","You might need to shift your weight to the opposite side of the foot you are trying to get onto the line; If you have access to a rodeoline with mats, this is a trick you can practice there first.",Es posible que tengas que desplazar tu peso hacia el lado opuesto del pie con el que intentas entrar en la línea.,,1 Jan 2022,TRUE,
Korean to Feet,,,,,https://www.youtube.com/watch?v=1hPL5d3en8c,KOREAN,STAND,3,From Korean you get both feet on top of the line at the same time followed by a Sit Mount in the same bounce or you put one foot on the line followed by a Soup to Feet in the same bounce.,Desde el coreano se ponen los dos pies encima de la línea. Luego haz un Sit Mount en el mismo rebote.,"Depending on your preferred variation, practice Sit to Feet or Soup to Feet first and then korean to feet will be a natural upgrade when you have the former solid enough.",Un mayor rebote te ayuda a estar de pie.,10184;10191,1 Jan 2022,TRUE,
Back to Feet,,,,,https://www.youtube.com/watch?v=MpfpSkwcqsg,BACK,STAND,3,"From Backbounce go to Korean and add a Korean to Feet in the same bounce. Alternatively, you can hook the line with one foot to assist pulling yourself up.","Desde la espalda, engancha un pie bajo la línea y desde este pie tira hasta una posición vertical. A continuación, utiliza el pie libre para ponerlo sobre la línea y ponerte de pie sobre ella. Antes de que termine el rebote desengancha el pie y ponte de pie.","Depending on your preferred variation, practice Sit to Feet or Korean to Feet first.",,10184;10181,1 Jan 2022,TRUE,
Chest to Feet,,,,,https://www.youtube.com/watch?v=Z11fkcCv_Qo,CHEST,STAND,3,From Chest you push the line down with one arm and the back foot in order to put your front foot on the line.,Desde el pecho se empuja la línea hacia abajo con un brazo y el pie trasero para poner el pie delantero en la línea.,,,,1 Jan 2022,TRUE,
Back Bounce,,,,,https://www.youtube.com/watch?v=MpfpSkwcqsg,STAND,BACK,3,"From standing on the line you let the line come towards your body on the top of the bounce and when your butt is on the line, slide your feet off the line and lean all the way back to land in Back.",De pie en la línea dejas que la línea venga hacia tu cuerpo en la parte superior del rebote y cuando tu trasero está en la línea te inclinas completamente hacia atrás y deslizas tus pies fuera de la línea para aterrizar en Back.,"Learn a Korean Bounce first, practice leaning back from Korean to Back, and then combine both motions into one bounce.",,10185,1 Jan 2022,TRUE,
Sit Bounce,,,,,https://www.youtube.com/watch?v=rdV2Jhi6U5Y,STAND,SIT,3,From standing on the line you let the line come towards your body on the top of the bounce and sit down keeping both of your feet on the line.,"De pie en la línea, dejas que la línea venga hacia tu cuerpo en la parte superior del rebote y te sientas manteniendo ambos pies en la línea.","Feels like sitting down on something behind you; Don't try to grab the line in case you loose your balance; It can help to practice Korean bounces first, then Soup bounces and then Sit bounces.",,10185;10192,1 Jan 2022,TRUE,
Sofa Bounce,,,,,https://www.youtube.com/watch?v=_CqGa-iBrHE,EXPOSURE,SOFA,3,From Exposure let the line come towards your body and grab the line with both hands then slide your feet off to land in Sofa.,"Desde la exposición deja que la línea se acerque a tu cuerpo y agarra la línea con ambas manos, luego desliza tus pies para aterrizar en Sofá.",It can help to practice briefly grabing the line at the top of the bounce while bouncing in Expo; This way you can learn to let the line come towards your butt instead of you droping down to Sofa.,,,1 Jan 2022,TRUE,
Belly Bounce,,,,,,EXPOSURE,BELLY,3,From Exposure let the line come towards your body and grab the line with both hands then slide your feet off to land in Belly.,"Desde la exposición deja que la línea se acerque a tu cuerpo y agarra la línea con ambas manos, luego desliza tus pies para aterrizar en Belly.",,,,1 Jan 2022,TRUE,
Reverse Panic Roll,,,,,,KOREAN,SOFA,3,From Korean you do a 270 BS spin to the front and then go into a Front Sofa Roll.,Desde el coreano se hace un giro hacia atrás junto con un giro hacia atrás terminando en Sofá.,,,10000,1 Jan 2022,FALSE,10000
Reverse Flowflip,Wolf Flip,,,,,KOREAN,KOREAN,4,"From Korean initiate a 360 BS spin to the front and simultaneously start a roll backwards, spin for a full 360 to land back in Korean after the roll is finished.",Desde el coreano hacer un giro de 360º hacia atrás junto con un giro hacia atrás terminando en coreano.,,,10015,1 Jan 2022,FALSE,10015
