Technical name,Name,Original performer,monthEstablished,yearEstablished,linkToVideo,Start position,End position,Difficulty,description,descriptionEs,tips,tipsEs,recommendedPrerequisites,dateAdded,isImportant,isVariationOf
Sick Nasty Double Roll,,Ian Eisenberg,,2020,https://youtu.be/qLEnzTtvTcA?t=21,SOFA,SOFA,5,Sick Nasty Roll with an additional Back Sofa Roll in the same bounce.,Rollo asqueroso con un rollo de sofá adicional en el mismo rebote.,,,10068,1 Jan 2022,FALSE,10044
Sofa 360 Double Roll,,Justin Wagers,,2020,https://youtu.be/hsALSrUdryU?t=134,SOFA,SOFA,5,Do a Sofa Roll 360 with an additional Back Sofa Roll in the end.,Realiza un Sofa Roll 360 con un Sofa Roll de espalda adicional al final.,You have to be fast with the regrab.,Hay que ser rápido con el regrab.,10022,1 Jan 2022,FALSE,10022
BS 180 Front Korean Roll to Feet,Fire Flip,Salomé Cholet,,2021,https://youtu.be/HecUpHXRpDw?t=302,KOREAN,STAND,6,Do a Mini-Fireflip to Feet.,Empieza como harías un Flowflip pero rodando de frente (en dirección a tu pecho) y haz un 180 en lugar de un 360.,,,10209,1 Jan 2022,TRUE,
Back Belly Roll to Feet,,,,,https://www.youtube.com/watch?v=7yLCyoHgUS0&t=723,BELLY,EXPOSURE,5,Do a Back Belly Roll to Feet.,Haz un Belly Roll a los pies pero rodando hacia atrás.,,,,1 Jan 2022,FALSE,10056
Flowflip to Feet,,,,,https://www.youtube.com/watch?v=kn15JZJOuAg,KOREAN,EXPOSURE,5,Do a Flowflip to Feet. ,Flowflip pero aterrizando a Pies en la Exposición.,During the flip get your far foot on the line. At the end of the flip get your second foot up on the line; A lot of people do it landing in Exposure.,"Durante el salto, pon el pie más lejano en la línea. Al final de la voltereta, pon el segundo pie en la línea.",10015,1 Jan 2022,TRUE,
Backbounce Richy Roll to Feet,,,,,https://www.youtube.com/watch?v=uuFlRIMmP8M&t=260,BACK,EXPOSURE,5,From Backbounce perform a Richy Roll but land it to Feet.,Desde el Backbounce realiza un Richy Roll pero aterriza directamente en los pies.,,,10226;10227,1 Jan 2022,FALSE,10226
Shoulder Roll to Feet,,,,,https://www.youtube.com/watch?v=7CZuU59KY_c&t=71,SHOULDER,EXPOSURE,5,From Shoulderstand roll to one side and get your feet on the line. Land in Exposure.,Desde la parada de hombros rueda hacia un lado y pon los pies en la línea. Aterriza en la exposición.,,,10051,1 Jan 2022,TRUE,
Panic Roll to Shoulder,,,,,https://youtu.be/uOuqykzwN7w?t=48,SOFA,SHOULDER,5,Do the Panic Roll but instead of landing in Chest you go into Shoulderstand.,Haz el rollo de pánico pero en lugar de aterrizar en el pecho te pones en posición de hombros.,Regrab with one hand to land comfortably in Shoulderstand.,Regrab con una mano para aterrizar cómodamente en Shoulderstand.,10000,1 Jan 2022,FALSE,10000
Yoda Roll,,Samuel Volery,,2016,https://www.youtube.com/watch?v=DgVLWsChXFM,EXPOSURE,EXPOSURE,6,From Exposure grab the line with both hands and roll around the line landing back in Exposure.,Desde la Exposición agarra la línea con ambas manos y rueda alrededor de la línea aterrizando de nuevo en la Exposición.,Try to wait a bit after hitting the bottom of the bounce before you start with the trick. If you start too early you will kill the bounce.,Intenta esperar un poco después de tocar el fondo del rebote antes de empezar con el truco. Si empiezas demasiado pronto matarás el rebote.,10199,1 Jan 2022,TRUE,
Back Yoda Roll,,Samuel Volery,,2017,https://youtu.be/QJzX6gaYQoM?t=34,EXPOSURE,EXPOSURE,6,From Exposure grab the line with both hands and roll around the line backwards landing back in Exposure.,Desde la Exposición agarra la línea con ambas manos y rueda alrededor de la línea hacia atrás aterrizando de nuevo en la Exposición.,Try to wait a bit after hitting the bottom of the bounce before you start with the trick. If you start too early you will kill the bounce.,Intenta esperar un poco después de tocar el fondo del rebote antes de empezar con el truco. Si empiezas demasiado pronto matarás el rebote.,10200,1 Jan 2022,FALSE,10119
Barrel Roll,,,,,https://www.youtube.com/watch?v=dG9sJvKjg6E&t=396,STAND,STAND,6,From your normal stance grab the line with both hands and roll around the line landing back in the starting position.,"Desde su posición normal, agarre la línea con ambas manos y ruede alrededor de la línea aterrizando de nuevo en la posición inicial.",,,10066,1 Jan 2022,TRUE,
Back Barrel Roll,,,,,https://www.youtube.com/watch?v=dG9sJvKjg6E&t=396,STAND,STAND,6,From your normal stance grab the line with both hands and roll around the line backwards landing back in the starting position.,"Desde tu postura normal, agarra la línea con ambas manos y rueda alrededor de la línea hacia atrás aterrizando de nuevo en la posición inicial.",,,10169,1 Jan 2022,FALSE,10122
Reverse Whatever,,Sebastian Egger,,2021,https://youtu.be/Ej2ocABoNC4?t=23482,LEASH,EXPOSURE,7,Drop into the leash and on the way up climb the leash and finish with a Reverse Obi-Wan.,Cae en una caída con correa y luego sube con los pies por detrás de la línea de manera similar a un Obi-Wan inverso.,Amazing leash fall saving trick.,Increíble truco para salvar la caída de la correa.,10074,1 Jan 2022,FALSE,10074
Sick Nasty Roll from Feet,,Ian Eisenberg,,2021,https://youtu.be/aAq4Tf8naOM?t=80,EXPOSURE,SOFA,6,Sick Nasty Roll but starting in Exposure.,Sick Nasty Roll pero comenzando en Exposure.,,,10068,1 Jan 2022,FALSE,10068
Korean 540 to Feet,Flower,Tim Odermatt,,2021,https://youtu.be/aAq4Tf8naOM?t=131,KOREAN,STAND,6,Like a normal Flow to Feet but adding a 180 at the end.,Como un Flow to Feet normal pero añadiendo un 180 al final.,,,10224,1 Jan 2022,FALSE,10284
Double Hammock Roll from Feet,Spaghetti Roll,Augustin Moinat,,2021,,STAND,BACK,6,Do a Hammock Roll from Feet and add an extra Hammock Roll at the end.,Doble rodillo hasta el rebote.,,,10023,1 Jan 2022,FALSE,10004
Double Sofa Roll to Feet,Tamatta Roll,Axel Weber,,2021,https://youtu.be/9Ab1JPDJR-I?t=250,SOFA,EXPOSURE,6,Double Sofa Roll landing in Exposure.,Aterrizaje del sofá doble en la exposición.,,,10199,1 Jan 2022,FALSE,10199
Sick Nasty 360,Tre Nasty,Ian Eisenberg,,2021,https://youtu.be/wHPNMiKrHsQ?t=44,SOFA,SOFA,6,Start with the motion of a Half Nasty 180 but pass your legs over the line once more and keep spinning to do a full 360 landing back in the starting position.,Comienza con el movimiento de un Sick Nasty 180 pero sigue girando y haz un 360 completo aterrizando de nuevo en la posición inicial.,,,10044,1 Jan 2022,TRUE,
Chest Roll 180 Flatspin to Feet,,Ian Eisenberg,,2021,https://www.youtube.com/watch?v=n2z3IyeQSj4&t=16,CHEST,EXPOSURE,6,Do a Chest Roll followed by a 180 Chest Flatspin to Feet.,Haz un Rollo de Pecho y en el mismo rebote un Flatspin de Pecho 180 a Pies.,,,,1 Jan 2022,FALSE,10007
Shapeshifter,,Ian Eisenberg,,2021,https://www.youtube.com/watch?v=QrUyUx8oJUY,EXPOSURE,ROCKET,6,From Exposure do a front flip off the line and catch the line to land in Rocket.,Desde Exposure haz una voltereta frontal fuera de la línea y atrapa la línea para aterrizar en Rocket.,,,,1 Jan 2022,TRUE,
Rocket Mount Side Roll to Sofa,,Ian Eisenberg,,2021,https://www.youtube.com/watch?v=7yLCyoHgUS0&t=1082,ROCKET,SOFA,6,From Rocket Mount do a Side Roll with the axis of rotation perpendicular to the line and land in Sofa.,Desde el montaje del cohete haz un giro lateral con el eje de rotación perpendicular a la línea y aterriza en Sofá.,Flip one of your hands to allow for a better initiation of the momentum.,Voltea una de tus manos para permitir una mejor iniciación del impulso.,,1 Jan 2022,FALSE,10067
Korean Roll from Feet to Feet,Sushi Roll,Ian Eisenberg,,2021,https://youtu.be/Ab2gW1rv5e8?t=16,STAND,STAND,6,Do a Korean Roll but starting from Feet and landing to Feet.,Haz un rollo coreano pero empezando por los pies y aterrizando en los pies.,,,10041,1 Jan 2022,TRUE,
180 Orbital to Feet,Sakalorbital,Ian Eisenberg,,2020,https://youtu.be/Ab2gW1rv5e8?t=69,STAND,EXPOSURE,7,"Grab the line with one hand, bring it around your body by passing it to your other hand above your head. Put the line back under your feet to land in Exposure.","Agarra la línea con una mano, llévala alrededor de tu cuerpo pasándola a tu otra mano y luego aterriza en Exposición.",,,10084,1 Jan 2022,FALSE,10283
Sick Nasty 360 to Chest,Tre Nasty to Chest,Ian Eisenberg,,2021,https://youtu.be/eP2pBpKv4wI?t=39,SOFA,CHEST,6,Tre Nasty landing in Chest.,Tre Nasty aterrizando en el pecho.,,,10109,1 Jan 2022,FALSE,10110
Freak Nasty to Feet,,Ian Eisenberg,,2020,https://youtu.be/T27UrrWAr7A?t=36,SOFA,EXPOSURE,6,Do a Freak Nasty landing in Exposure.,Haz un Half Nasty pero con un aterrizaje de 180 en Exposure.,,,,1 Jan 2022,FALSE,10072
540 Spin,,Joshua Leupolz,,2021,https://youtu.be/qUxUNfgvoPs?t=46,STAND,STAND,6,Spin 540 on the line in a standing position.,Gira 540 en la línea en posición de pie.,,,10228,1 Jan 2022,FALSE,10228
Reverse Rocket Mount,,Samuel Volery,,2019,https://youtu.be/uOuqykzwN7w?t=171,ROCKET,EXPOSURE,6,From Rocket swing your legs up (feet first) and put both feet on the line inside of your hands and land in Exposure. ,Como un Rocket Mount pero subiendo por detrás de la línea.,Sam and Ian have quite different techniques for this trick. Try both and see which one suits you (or do your own variation of course).,"Sam e Ian tienen técnicas bastante diferentes para este truco. Prueba ambos y ve cuál te conviene (o haz tu propia variación, por supuesto).",,1 Jan 2022,TRUE,
Almighty Flip,,Axel Weber,,2020,https://youtu.be/jIBjYEMRhrQ,EXPOSURE,EXPOSURE,7,From Exposure do a front flip while hooking one foot under the line and putting it back on the line for the landing.,Desde la Exposición haz una voltereta frontal mientras enganchas un pie bajo la línea y lo vuelves a poner en la línea para el aterrizaje.,After 270 deg of rotation try to pull the line under yourself with your feet.,"Después de 270 grados de rotación, intenta tirar de la línea debajo de ti con los pies.",10119,1 Jan 2022,TRUE,
Barrel Almighty Flip,,Justin Wagers,,2020,https://youtu.be/Se5XNo0RSP8?t=649,STAND,STAND,7,Almighty flip but from normal stance.,Voltereta todopoderosa pero desde la posición normal.,,,10122,1 Jan 2022,TRUE,
Back Barrel Almighty Flip,,Justin Wagers,,2020,https://youtu.be/Se5XNo0RSP8?t=426,STAND,STAND,7,Like the Barrel Almighty Flip but flipping backside.,Como la vuelta del barril pero volteando en la otra dirección.,,,10123,1 Jan 2022,FALSE,10136
Back Almighty Flip,,Sebastian Egger,,2020,https://youtu.be/jIBjYEMRhrQ,EXPOSURE,EXPOSURE,7,From Exposure do a back flip while hooking one foot under the line and putting it back on the line for the landing.,Desde la Exposición haz una voltereta hacia atrás mientras enganchas un pie bajo la línea y lo pones de nuevo en la línea para el aterrizaje.,First lean back and then kick/hook the line.,Primero inclínate hacia atrás y luego patea/engancha la línea.,10120,1 Jan 2022,FALSE,10124
Back Korean Roll 360 to Chest,Despedido,Sakalomo,,2021,https://www.youtube.com/watch?v=7yLCyoHgUS0&t=1036,KOREAN,CHEST,5,"Start with a Back Korean Roll during which you are leaning forward, move your legs above the line to transition into a 360, land in Korean.",Es un rollo coreano trasero y un 360 al mismo tiempo.,,,,1 Jan 2022,TRUE,
Shrimp Double Flip,Kung Pao,Ian Eisenberg,,2021,https://www.instagram.com/p/CXPSK-BKQAg/,ROCKET,ROCKET,-1,Do a Shrimpflip and in the same bounce another roll backwards around the line.,Haz un Shrimpflip y en el mismo rebote otra vuelta alrededor de la línea.,,,10060;10121,1 Jan 2022,FALSE,10060
Back No Soup,,Tim Odermatt,,2021,https://www.instagram.com/p/CVvIbn3lFqU/,SOUP,EXPOSURE,7,"A Can of Soup without hands, basically a Back Almighty starting from Soup.","Una lata de sopa sin manos, básicamente un Back Almighty partiendo de Sit.","Throw your hands in the air at the bottom of the bounce, it will allow you to gain more momentum to finish the rotation.","Lanza las manos al aire en la parte inferior del rebote, te permitirá ganar más impulso para terminar la rotación.",10143,1 Jan 2022,FALSE,10066
Leash to Feet,Whatever,Enzo Fuchs,,2021,https://www.instagram.com/p/CRyXVw0ISbI/,LEASH,EXPOSURE,7,Drop into the leash and on the way up climb the leash and finish with a Rocket Mount.,Déjate caer en una caída de la correa y al subir sube la correa y tira de la línea bajo tus pies.,,,10073,1 Jan 2022,FALSE,10067
Sick Nasty from Feet to Feet,,Enzo Fuchs,,2021,https://www.instagram.com/p/CWQrmuTAwNl/,EXPOSURE,EXPOSURE,6,Sick Nasty from Feet to Feet.,Enfermo asqueroso de pies a cabeza.,,,10044;10072,1 Jan 2022,FALSE,10072
Back Roll from Chest to Feet,Frog Flip,Ian Eisenberg,,2022,https://www.instagram.com/p/CYPPtWFvkIg/,CHEST,STAND,7,From Chest you push off the line with both hands to get into a Back Roll to Feet.,Desde el pecho empujas la línea con ambas manos para entrar en un backflip y luego aterrizar a Pies.,,,,1 Jan 2022,FALSE,10079
Underflip to Feet,Fireball,Cesare Bellamoli,Apr,2022,https://youtu.be/eUguTccJblI?t=45,KOREAN,EXPOSURE,-1,"From Korean, do a BS 270 spin and finish with a Back Belly Roll to Feet.",,,,,9 May 2022,FALSE,10100
Tre Nasty Roll,Tre Flip,Ian Eisenberg,,2021,https://www.instagram.com/p/CUayzIYg49i/,SOFA,SOFA,7,Start with the motion of a Half Nasty 180 but pass your legs over the line once more and keep spinning to do a full 360 and then add a roll around the line to land back in the starting position.,"Comienza con el movimiento de un Half Nasty 180 pero sigue girando, haz un 360 completo y añade un giro, aterrizando de nuevo en la posición inicial.",,,10109,1 Jan 2022,FALSE,10109
No Foot Almighty Flip,High'N'Mighty,Ian Eisenberg,,2021,https://www.instagram.com/p/CVYpkmVg2FY/,STAND,STAND,7,Barrel Front Almighty Flip but instead of hooking the line with your foot you press the line against your leg.,"Barrel Front Almighty Flip pero en lugar de enganchar la línea con el pie, presionas la línea contra tu otra pierna.",,,10124,1 Jan 2022,FALSE,10124
180 Back Roll from Feet,180 Backflop,Ian Eisenberg,,2021,https://www.youtube.com/watch?v=A8O3iGYGPPk&t=135,STAND,KOREAN,6,Do a 180 and then do a Backflop.,Haz un 180 y luego pasa a un Rollo de Espalda desde los Pies.,,,10086,1 Jan 2022,FALSE,10086
NH Panic Roll to Feet,Panic Attack,Ian Eisenberg,,2021,https://www.youtube.com/watch?v=7yLCyoHgUS0&t=1355,SOFA,EXPOSURE,7,You do a Panic Roll to Feet but don't use your hands to hold the line. Instead use your foot to hook the line and go to Feet.,"Haces un Rollo de Pánico a Pies pero no usas las manos para sujetar la línea. En lugar de ello, utiliza el pie para enganchar la línea y pasar a Pies.",,,10050,1 Jan 2022,TRUE,
Shrimpflip 180 to Feet,King Prawn,Ian Eisenberg,,2021,https://youtu.be/7yLCyoHgUS0?t=1560,ROCKET,EXPOSURE,7,Do a Shrimpflip 180 but then go to Feet.,Haz un Shrimpflip 180 pero luego ve a Pies.,,,10229,1 Jan 2022,TRUE,
180 Front Roll from Feet,180 Frontflop,Ian Eisenberg,,2021,https://youtu.be/A8O3iGYGPPk?t=116,STAND,KOREAN,6,From Standing you turn 180 and do a Frontflop.,Desde la posición de pie se gira 180 y se hace un Frontroll desde los pies.,,,10080,1 Jan 2022,FALSE,10080
360 Orbital to Feet,,Ian Eisenberg,,2021,https://youtu.be/A8O3iGYGPPk?t=175,STAND,STAND,8,Orbital to Feet but with a 360 spin.,Orbital a Pies pero con un giro de 360.,,,10115,1 Jan 2022,FALSE,10283
Antihero to Feet,Darth Vader,Ian Eisenberg,,2021,https://www.youtube.com/watch?v=V0fMaONFvVY,ROCKET,EXPOSURE,7,Like an Antihero but landing in Exposure.,Como un Antihéroe a Sofá pero aterrizando en Exposición.,,,10039,1 Jan 2022,TRUE,
90 to Yoda Roll,Adrenaline Roll,Ian Eisenberg,,2020,https://youtu.be/qLEnzTtvTcA?t=38,STAND,EXPOSURE,6,Do a 90 with restepping and go into a Yoda Roll.,Haz un 90 con restepping y pasa a un Yoda Roll.,,,10050,1 Jan 2022,TRUE,
Han Solo,,Jim Galli,,2020,https://www.youtube.com/watch?v=dG9sJvKjg6E&t=323,EXPOSURE,EXPOSURE,6,Almighty Flip but instead of hooking the line with your foot you grab and pull on the leash.,"Almighty Flip, pero en lugar de enganchar la línea con el pie, agarras y tiras de la correa.",,,10119,1 Jan 2022,TRUE,
Backbounce Panic Roll 180 to Feet,Backbounce Nirvana,Justin Wagers,,2021,https://www.instagram.com/p/CSW1c4Li76j/,BACK,EXPOSURE,7,Nirvana from Backbounce.,Nirvana de Backbounce.,,,10140,1 Jan 2022,FALSE,10085
Panic Double Roll to Feet,,Justin Wagers,,2021,https://youtu.be/RDVaUFdqMmE?t=261,SOFA,EXPOSURE,7,Panic Roll with an additional roll landing to Feet.,Rollo de pánico con un rollo de pecho adicional aterrizando a los pies.,,,10050,1 Jan 2022,FALSE,10050
Double Can of Soup,,Justin Wagers,,2019,https://youtu.be/rWqH_51ztQA?t=6977,SOUP,STAND,7,From Soup do a double roll and land on your feet in normal stance.,Desde la posición de sentado (con una pierna) se hacen dos rollos hacia el lado y se aterriza sobre los pies en posición normal.,,,10066,1 Jan 2022,FALSE,10066
Sofa Roll 360 to Feet,Nirvana,Salomé Cholet,,2021,https://youtu.be/7yLCyoHgUS0?t=580,SOFA,EXPOSURE,7,Do a Sofa Roll 360 and land in Exposure.,Haz un Sofa Roll 360 pero ve hacia los pies y aterriza en la exposición.,,,10022;10069,1 Jan 2022,FALSE,10050
FS 360 Rocket Mount,,Sebastian Egger,,2021,https://www.instagram.com/p/CPgJRJHK777/,ROCKET,EXPOSURE,7,Rocket Mount with a 360.,Montaje de cohete con un 360.,First spin a little bit into the opposite direction to then explode out the way you really want to spin.; Try to avoid doing a Rocket Mount 180 and then restep with your feet but go for the 360 right away.,"Primero gira un poco en la dirección opuesta para luego explotar en la dirección que realmente quieres girar; trata de evitar hacer un Rocket Mount 180 y luego vuelve a dar un paso con los pies, pero ve a por el 360 de inmediato.",10097,1 Jan 2022,TRUE,
Sofa 540 to Feet,,Sebastian Egger,,2021,https://www.instagram.com/p/CPgJRJHK777/,SOFA,EXPOSURE,7,Like a Sofa 360 to Feet but with a late 180.,Desde el Sofá se hace un Sofá 360 a Pies pero se añade un 180 al final.,Try to not do the 360 and then restep to get the 540 but instead go for the 540 directly.,"Intenta no hacer el 360 y luego el restep para conseguir el 540, sino que ve directamente a por el 540.",10069,1 Jan 2022,FALSE,10069
Switch 270 Yoda Roll Fake 90,Flowflip from Feet to Feet,Sebastian Egger,,2021,,STAND,STAND,7,From switch do 270 spin and go into a Yoda Roll and finish by turning to normal stance.,"Desde la posición de cambio, gira 180 con sólo girar los pies (sin pisar). Luego haz un Adrenaline Roll pero cuando estés aterrizando, gira los pies de nuevo para no aterrizar en Exposición sino en postura normal.",Either start or land in switch.,O bien empieza o aterriza en el interruptor.,10171,1 Jan 2022,FALSE,10102
Butter Roll to Feet,Tesseract,Ian Eisenberg,,2021,https://www.instagram.com/p/CVhgrM6B6jd/,SOFA,EXPOSURE,7,"Start by doing the Butter and roll to your back, put your feet on the line to land in Expo.",Comienza haciendo el Butter y rueda hacia tu espalda para aterrizar en la Expo.,,,10230,1 Jan 2022,TRUE,10230
180 Front Yoda Roll,,Ian Eisenberg,,2021,https://youtu.be/Ab2gW1rv5e8?t=22,EXPOSURE,EXPOSURE,7,From Exposure do a 180 and during the spin go into the Yoda Roll.,Desde la Exposición haz un 180 y durante el giro entra en el Yoda Roll.,,,10119,1 Jan 2022,FALSE,10119
BS 270 Back Yoda Roll,Dojo Roll,Ian Eisenberg,,2021,https://youtu.be/BOGMXJsXWCE?t=31,STAND,EXPOSURE,7,Turn 180 to your BS and go into a Back Yoda Roll finishing the last 90 degrees of spin.,Gira 180 hacia tu BS y entra en un Back Yoda Roll terminando los últimos 90 grados de giro.,,,10120;10145,1 Jan 2022,TRUE,
Almighty from Sofa,Dirty Sofa,Tim Odermatt,,2021,,SOFA,EXPOSURE,7,"Start in Sofa, then bring one foot up to the line to hook it and go for an Almighty Flip.",Comienza en Sofá y luego lleva un pie hasta la línea para engancharla y hacer una Voltereta Todopoderosa.,,,10124,1 Jan 2022,TRUE,
Double Shoulder Roll to Feet,,Enzo Fuchs,,2020,https://www.instagram.com/p/CFKdxdlq9yd/,SHOULDER,EXPOSURE,7,Double Shoulder Roll landing in Exposure.,Aterrizaje con doble hombro en la exposición.,,,,1 Jan 2022,FALSE,10104
Front Yoda Rewind,,Sebastian Egger,,2021,https://youtu.be/aAq4Tf8naOM?t=135,EXPOSURE,EXPOSURE,8,It's almost a Front Yoda Roll and a Back Yoda Roll in the same bounce. Start at the very bottom of the bounce with a Front Yoda Roll so the line snaps up and after around three quarters of rotation you have some resistance of the line to push off of into the Back Yoda Roll. ,Es casi un Yoda Roll frontal y un Yoda Roll trasero en el mismo rebote. Comienza en la parte inferior del rebote con un Yoda Roll frontal para que la línea se levante y después de tres cuartos de rotación tengas algo de resistencia de la línea para empujar hacia el Yoda Roll trasero. ,Start a lot earlier than you would for most tricks.,Empieza mucho antes de lo que lo harías para la mayoría de los trucos.,,1 Jan 2022,FALSE,10156
Back Yoda Rewind,,Tim Odermatt,,2021,,EXPOSURE,EXPOSURE,8,It's almost a Back Yoda Roll and a Front Yoda Roll in the same bounce. Start at the very bottom of the bounce with a Back Yoda Roll so the line snaps up and after around three quarters of rotation you have some resistance of the line to push off of into the Front Yoda Roll. ,Es casi un Back Yoda Roll y un Front Yoda Roll en el mismo rebote. Comienza en la parte inferior del rebote con un Yoda Roll trasero para que la línea se levante y después de tres cuartos de rotación tengas algo de resistencia de la línea para empujar hacia el Yoda Roll delantero. ,Start a lot earlier than you would for most tricks.,Empieza mucho antes de lo que lo harías para la mayoría de los trucos.,,1 Jan 2022,FALSE,10156
Tre Nasty to Feet,,Ian Eisenberg,,2021,,SOFA,STAND,-1,Tre Nasty landing to Feet.,Tre Nasty aterrizando a Pies.,,,10109,1 Jan 2022,FALSE,10109
360 Expo Orbital to Feet,Cosmonaut,Ian Eisenberg,,2021,https://youtu.be/lzz9jvtYpi0?t=567,EXPOSURE,EXPOSURE,8,Expoorbital to Feet with a 360 spin.,Expoorbital a Pies con un giro de 360.,,,10115,1 Jan 2022,TRUE,
Hammock Roll from Feet to Feet,Lasagna Roll,Augustin Moinat,,2021,https://youtu.be/aAq4Tf8naOM?t=139,STAND,STAND,8,Hammock Roll starting from Feet and going directly back to Feet.,Rodar en hamaca empezando por los pies y volviendo directamente a los pies.,,,10023;10092,1 Jan 2022,FALSE,10092
Panic Roll 180 from Feet to Feet,Total Nirvana,Sakalomo,,2021,https://youtu.be/HecUpHXRpDw?t=55,EXPOSURE,EXPOSURE,8,Basically a Sofa Roll 360 from Feet to Feet.,Básicamente un Sofá Roll 360 de Pies a Pies.,,,10140,1 Jan 2022,FALSE,10140
Back Roll from Feet to Feet,Backflip,Ian Eisenberg,,2021,https://youtu.be/Ej2ocABoNC4?t=18588,STAND,STAND,8,It is a Back Roll from Feet to Feet.,¡El Backflip de highline freestyle! Como su nombre indica es un Back Roll de pies a pies.,,,10079;10086,1 Jan 2022,TRUE,
Rocket Front Belly Roll to Feet,Supersonic Mount,Ian Eisenberg,,2020,https://www.youtube.com/watch?v=r5rwYkvnbco,ROCKET,EXPOSURE,7,From Rocket get a lot of momentum with your feet and do one roll forward around the line and land in Exposure.,Desde el Hanging coge mucho impulso con los pies y haz un roll frontal alrededor de la línea y aterriza en Exposure.,,,10056,1 Jan 2022,TRUE,
Double Back Yoda Roll,Back Turtle Roll,Ian Eisenberg,,2020,https://www.youtube.com/watch?v=RerW2T7edVA,EXPOSURE,EXPOSURE,7,Two Back Yoda Rolls in one bounce.,Dos Rollos de Yoda hacia atrás en un solo rebote.,,,10120,1 Jan 2022,FALSE,10156
Sick Nasty Roll to Feet,Darkside Roll,Ian Eisenberg,,2020,https://youtu.be/Ab2gW1rv5e8?t=79,SOFA,EXPOSURE,7,Do a Sick Nasty Roll but instead of swinging both your legs over the line again put one foot on the line and keep the other one behind the line. Then put the second foot on and stick the trick.,"Comienza con un Sick Nasty Roll, pero en lugar de balancear ambas piernas sobre la línea, pon un pie en la línea y mantén el otro detrás de la línea. Luego pon el segundo pie y pega el truco.",,,10068,1 Jan 2022,TRUE,
180 Darth Vader,,Ian Eisenberg,,2021,https://youtu.be/HecUpHXRpDw?t=218,ROCKET,EXPOSURE,8,Darth Vader with a 180.,Darth Vader con un 180.,,,10074,1 Jan 2022,FALSE,10132
180 Almighty Flip,,Ian Eisenberg,,2021,https://youtu.be/n2z3IyeQSj4?t=88,EXPOSURE,EXPOSURE,8,Do a 180 and then go into a Front Almighty Flip.,Haz un giro de 180º y luego entra en una voltereta frontal todopoderosa.,,,10124,1 Jan 2022,FALSE,10124
Double Barrel Roll,,Justin Wagers,,2021,https://www.youtube.com/watch?v=VP49hErTqM0&t=415,STAND,STAND,7,Double Barrel Roll.,Rodillo de doble barril.,,,10139,1 Jan 2022,TRUE,
Frontroll from Feet to Feet,Frontflip (Chrysalis),Nick Day,,2021,https://www.youtube.com/watch?v=8fqUe9ZQvAc,STAND,STAND,8,Front Roll from Feet to Feet.,En un rebote haz un Frontroll partiendo de Pies y aterrizando de nuevo en Pies.,Longer lines allow for more time to execute the trick.,Las líneas más largas permiten más tiempo para ejecutar el truco.,10080;10231,1 Jan 2022,TRUE,
Double Yoda Roll,Turtle Roll,Pablo Signoret,,,https://www.youtube.com/watch?v=VP49hErTqM0&t=420,EXPOSURE,EXPOSURE,7,Two Yoda Rolls in one bounce.,Dos rollos de Yoda en un rebote.,,,10107,1 Jan 2022,TRUE,
Fake 360 Almighty Flip,,Sebastian Egger,,2021,https://www.instagram.com/p/COPXx5vtOBy/,STAND,STAND,8,"Starting in switch do a 270 spin, go into a Front Almighty Flip and in the end turn 90 to look back at the same anchor as where you started.","Empezando en posición de cambio, haces un giro de 270 y pasas a un Front Almighty Flip al final giras 90 para mirar de nuevo al mismo ancla donde empezaste.",,,10153,1 Jan 2022,FALSE,10162
